{
  "round": 5,
  "phase": "action",
  "initiative": 1,
  "players": {
    "1": {
      "seat": 1,
      "baseHp": 30,
      "baseMaxHp": 30,
      "handSize": 4,
      "hand": [
        "SHD#040:2",
        "LOF#215:3",
        "ASH#251:3",
        "LAW#253:3"
      ],
      "resourcesReady": 6,
      "resourcesExhausted": 0,
      "resources": [
        "LAW#253",
        "ASH#251",
        "SOR#095",
        "LOF#215",
        "SOR#095:2",
        "LAW#253:2"
      ],
      "credits": 0,
      "hasForce": false,
      "discard": [
        "LOF#215:2",
        "ASH#251:2"
      ],
      "cards": [
        {
          "id": "SHD#040",
          "zone": "ground",
          "damage": 0,
          "exhausted": false,
          "upgrades": [],
          "shields": 0,
          "experience": 0,
          "statusTokens": {},
          "captured": [],
          "power": 1,
          "hp": 2,
          "keywords": []
        },
        {
          "id": "JTL#067",
          "zone": "space",
          "damage": 0,
          "exhausted": false,
          "upgrades": [],
          "shields": 2,
          "experience": 0,
          "statusTokens": {},
          "captured": [],
          "power": 3,
          "hp": 2,
          "keywords": []
        }
      ],
      "deckSize": 2,
      "leader": {
        "id": "SOR#005",
        "deployed": false,
        "exhausted": false,
        "epicActionUsed": false
      }
    },
    "2": {
      "seat": 2,
      "baseHp": 23,
      "baseMaxHp": 25,
      "handSize": 2,
      "hand": [
        "TWI#077",
        "TWI#174:3"
      ],
      "resourcesReady": 6,
      "resourcesExhausted": 0,
      "resources": [
        "IC27#097",
        "IC27#097:2",
        "IC27#097:5",
        "IC27#097:7",
        "IC27#097:9",
        "IC27#097:10"
      ],
      "baseEpicActionUsed": false,
      "credits": 0,
      "hasForce": false,
      "discard": [
        "TWI#174",
        "TWI#174:2"
      ],
      "cards": [
        {
          "id": "IC27#097:3",
          "zone": "ground",
          "damage": 0,
          "exhausted": false,
          "upgrades": [],
          "shields": 0,
          "experience": 0,
          "statusTokens": {},
          "captured": [],
          "power": 3,
          "hp": 1,
          "keywords": []
        },
        {
          "id": "IC27#097:4",
          "zone": "ground",
          "damage": 0,
          "exhausted": false,
          "upgrades": [],
          "shields": 0,
          "experience": 0,
          "statusTokens": {},
          "captured": [],
          "power": 3,
          "hp": 1,
          "keywords": []
        },
        {
          "id": "IC27#097:6",
          "zone": "ground",
          "damage": 0,
          "exhausted": false,
          "upgrades": [],
          "shields": 0,
          "experience": 0,
          "statusTokens": {},
          "captured": [],
          "power": 3,
          "hp": 1,
          "keywords": []
        },
        {
          "id": "IC27#097:8",
          "zone": "ground",
          "damage": 0,
          "exhausted": false,
          "upgrades": [],
          "shields": 0,
          "experience": 0,
          "statusTokens": {},
          "captured": [],
          "power": 3,
          "hp": 1,
          "keywords": []
        }
      ],
      "deckSize": 2,
      "leader": {
        "id": "SOR#010",
        "deployed": false,
        "exhausted": false,
        "epicActionUsed": false
      }
    }
  },
  "initiativeTaken": false,
  "active": 1
}
