{
  "round": 5,
  "phase": "action",
  "initiative": 1,
  "players": {
    "1": {
      "seat": 1,
      "baseHp": 30,
      "baseMaxHp": 30,
      "handSize": 1,
      "hand": [
        "LAW#253:4"
      ],
      "resourcesReady": 6,
      "resourcesExhausted": 0,
      "resources": [
        "IC27#097",
        "SOR#138",
        "SOR#154",
        "LAW#253",
        "LAW#253:2",
        "LAW#253:3"
      ],
      "foreignResources": [],
      "baseUpgrades": [],
      "baseCaptured": [],
      "credits": 0,
      "hasForce": false,
      "discard": [
        "SHD#144",
        "SOR#160",
        "SOR#154:2",
        "IC27#097:2",
        "SOR#138:2",
        "IC27#097:3",
        "IC27#097:4"
      ],
      "cards": [],
      "deckSize": 7,
      "leader": {
        "id": "SOR#010",
        "deployed": false,
        "exhausted": false,
        "epicActionUsed": false
      },
      "abilityUses": []
    },
    "2": {
      "seat": 2,
      "baseHp": 30,
      "baseMaxHp": 30,
      "handSize": 2,
      "hand": [
        "SOR#095:5",
        "SOR#095:6"
      ],
      "resourcesReady": 6,
      "resourcesExhausted": 0,
      "resources": [
        "LAW#253:5",
        "LAW#253:6",
        "LAW#253:7",
        "LAW#253:8",
        "LAW#253:9",
        "LAW#253:12"
      ],
      "foreignResources": [],
      "baseUpgrades": [],
      "baseCaptured": [],
      "credits": 0,
      "hasForce": false,
      "discard": [
        "SOR#095",
        "SOR#095:2",
        "SOR#095:3",
        "SOR#095:4"
      ],
      "cards": [
        {
          "id": "LAW#253:10",
          "zone": "space",
          "damage": 0,
          "exhausted": false,
          "upgrades": [],
          "shields": 0,
          "experience": 0,
          "statusTokens": {},
          "captured": [],
          "power": 2,
          "hp": 3,
          "keywords": [],
          "traits": [
            "fighter",
            "rebel",
            "vehicle"
          ]
        },
        {
          "id": "LAW#253:11",
          "zone": "space",
          "damage": 0,
          "exhausted": false,
          "upgrades": [],
          "shields": 0,
          "experience": 0,
          "statusTokens": {},
          "captured": [],
          "power": 2,
          "hp": 3,
          "keywords": [],
          "traits": [
            "fighter",
            "rebel",
            "vehicle"
          ]
        }
      ],
      "deckSize": 2,
      "leader": {
        "id": "SOR#009",
        "deployed": false,
        "exhausted": false,
        "epicActionUsed": false
      },
      "abilityUses": []
    }
  },
  "initiativeTaken": false,
  "active": 1,
  "effects": []
}
