{
  "round": 5,
  "phase": "action",
  "initiative": 1,
  "players": {
    "1": {
      "seat": 1,
      "baseHp": 30,
      "baseMaxHp": 30,
      "handSize": 2,
      "hand": [
        "LAW#253:4",
        "LAW#253:5"
      ],
      "resourcesReady": 6,
      "resourcesExhausted": 0,
      "resources": [
        "SOR#095",
        "SOR#095:2",
        "SHD#040",
        "SOR#095:3",
        "SHD#040:2",
        "SOR#095:4"
      ],
      "baseUpgrades": [],
      "baseCaptured": [],
      "credits": 0,
      "hasForce": false,
      "discard": [
        "JTL#058",
        "LAW#253"
      ],
      "cards": [
        {
          "id": "LAW#253:2",
          "zone": "space",
          "damage": 0,
          "exhausted": false,
          "upgrades": [
            "JTL#058:2"
          ],
          "shields": 0,
          "experience": 0,
          "statusTokens": {},
          "captured": [],
          "power": 3,
          "hp": 5,
          "keywords": [
            "sentinel"
          ]
        },
        {
          "id": "LAW#253:3",
          "zone": "space",
          "damage": 0,
          "exhausted": false,
          "upgrades": [
            "JTL#058:3"
          ],
          "shields": 0,
          "experience": 0,
          "statusTokens": {},
          "captured": [],
          "power": 3,
          "hp": 5,
          "keywords": [
            "sentinel"
          ]
        }
      ],
      "deckSize": 2,
      "leader": {
        "id": "SOR#005",
        "deployed": false,
        "exhausted": false,
        "epicActionUsed": false
      }
    },
    "2": {
      "seat": 2,
      "baseHp": 16,
      "baseMaxHp": 25,
      "handSize": 3,
      "hand": [
        "TWI#077:2",
        "SHD#238:4",
        "TWI#077:3"
      ],
      "resourcesReady": 6,
      "resourcesExhausted": 0,
      "resources": [
        "SHD#238",
        "IC27#097",
        "SHD#238:2",
        "IC27#097:4",
        "IC27#097:6",
        "IC27#097:7"
      ],
      "baseEpicActionUsed": false,
      "baseUpgrades": [],
      "baseCaptured": [],
      "credits": 0,
      "hasForce": false,
      "discard": [
        "TWI#077"
      ],
      "cards": [
        {
          "id": "IC27#097:2",
          "zone": "ground",
          "damage": 0,
          "exhausted": false,
          "upgrades": [],
          "shields": 0,
          "experience": 0,
          "statusTokens": {},
          "captured": [],
          "power": 3,
          "hp": 1,
          "keywords": []
        },
        {
          "id": "IC27#097:3",
          "zone": "ground",
          "damage": 0,
          "exhausted": false,
          "upgrades": [],
          "shields": 0,
          "experience": 0,
          "statusTokens": {},
          "captured": [],
          "power": 3,
          "hp": 1,
          "keywords": []
        },
        {
          "id": "SHD#238:3",
          "zone": "ground",
          "damage": 0,
          "exhausted": false,
          "upgrades": [],
          "shields": 0,
          "experience": 0,
          "statusTokens": {},
          "captured": [],
          "power": 3,
          "hp": 3,
          "keywords": [
            "sentinel"
          ]
        },
        {
          "id": "IC27#097:5",
          "zone": "ground",
          "damage": 0,
          "exhausted": false,
          "upgrades": [],
          "shields": 0,
          "experience": 0,
          "statusTokens": {},
          "captured": [],
          "power": 3,
          "hp": 1,
          "keywords": []
        }
      ],
      "deckSize": 2,
      "leader": {
        "id": "SOR#010",
        "deployed": false,
        "exhausted": false,
        "epicActionUsed": false
      }
    }
  },
  "initiativeTaken": false,
  "active": 1
}
