{
  "round": 4,
  "phase": "action",
  "initiative": 1,
  "players": {
    "1": {
      "seat": 1,
      "baseHp": 21,
      "baseMaxHp": 30,
      "handSize": 3,
      "hand": [
        "TWI#128:2",
        "TWI#128:3",
        "LAW#253:6"
      ],
      "resourcesReady": 5,
      "resourcesExhausted": 0,
      "resources": [
        "LAW#253",
        "LAW#253:2",
        "LAW#253:3",
        "LAW#253:4",
        "LAW#253:5"
      ],
      "foreignResources": [],
      "baseUpgrades": [],
      "baseCaptured": [],
      "credits": 0,
      "hasForce": false,
      "discard": [
        "TWI#128",
        "SOR#095"
      ],
      "cards": [
        {
          "id": "SOR#095:2",
          "zone": "ground",
          "damage": 0,
          "exhausted": false,
          "upgrades": [],
          "shields": 0,
          "experience": 0,
          "statusTokens": {},
          "captured": [],
          "power": 3,
          "hp": 3,
          "keywords": [],
          "traits": [
            "rebel",
            "trooper"
          ]
        },
        {
          "id": "SOR#095:3",
          "zone": "ground",
          "damage": 0,
          "exhausted": false,
          "upgrades": [],
          "shields": 0,
          "experience": 0,
          "statusTokens": {},
          "captured": [],
          "power": 3,
          "hp": 3,
          "keywords": [],
          "traits": [
            "rebel",
            "trooper"
          ]
        }
      ],
      "deckSize": 4,
      "leader": {
        "id": "SOR#009",
        "deployed": false,
        "exhausted": false,
        "epicActionUsed": false
      },
      "abilityUses": []
    },
    "2": {
      "seat": 2,
      "baseHp": 30,
      "baseMaxHp": 30,
      "handSize": 1,
      "hand": [
        "IC27#097:7"
      ],
      "resourcesReady": 5,
      "resourcesExhausted": 0,
      "resources": [
        "SHD#238",
        "SHD#238:2",
        "TWI#174",
        "IC27#097:3",
        "SHD#238:3"
      ],
      "foreignResources": [],
      "baseUpgrades": [],
      "baseCaptured": [],
      "credits": 0,
      "hasForce": false,
      "discard": [
        "TWI#174:2"
      ],
      "cards": [
        {
          "id": "IC27#097:2",
          "zone": "ground",
          "damage": 0,
          "exhausted": false,
          "upgrades": [],
          "shields": 0,
          "experience": 0,
          "statusTokens": {},
          "captured": [],
          "power": 3,
          "hp": 1,
          "keywords": [],
          "traits": [
            "imperial",
            "trooper"
          ]
        },
        {
          "id": "IC27#097",
          "zone": "ground",
          "damage": 0,
          "exhausted": false,
          "upgrades": [],
          "shields": 0,
          "experience": 0,
          "statusTokens": {},
          "captured": [],
          "power": 3,
          "hp": 1,
          "keywords": [],
          "traits": [
            "imperial",
            "trooper"
          ]
        },
        {
          "id": "IC27#097:4",
          "zone": "ground",
          "damage": 0,
          "exhausted": false,
          "upgrades": [],
          "shields": 0,
          "experience": 0,
          "statusTokens": {},
          "captured": [],
          "power": 3,
          "hp": 1,
          "keywords": [],
          "traits": [
            "imperial",
            "trooper"
          ]
        },
        {
          "id": "IC27#097:5",
          "zone": "ground",
          "damage": 0,
          "exhausted": false,
          "upgrades": [],
          "shields": 0,
          "experience": 0,
          "statusTokens": {},
          "captured": [],
          "power": 3,
          "hp": 1,
          "keywords": [],
          "traits": [
            "imperial",
            "trooper"
          ]
        },
        {
          "id": "IC27#097:6",
          "zone": "ground",
          "damage": 0,
          "exhausted": false,
          "upgrades": [],
          "shields": 0,
          "experience": 0,
          "statusTokens": {},
          "captured": [],
          "power": 3,
          "hp": 1,
          "keywords": [],
          "traits": [
            "imperial",
            "trooper"
          ]
        }
      ],
      "deckSize": 4,
      "leader": {
        "id": "SOR#010",
        "deployed": false,
        "exhausted": false,
        "epicActionUsed": false
      },
      "abilityUses": []
    }
  },
  "initiativeTaken": false,
  "active": 1,
  "effects": []
}
