{
  "round": 5,
  "phase": "action",
  "initiative": 1,
  "players": {
    "1": {
      "seat": 1,
      "baseHp": 17,
      "baseMaxHp": 30,
      "handSize": 4,
      "hand": [
        "SOR#232:2",
        "SOR#095:5",
        "LAW#253",
        "SOR#232"
      ],
      "resourcesReady": 6,
      "resourcesExhausted": 0,
      "resources": [
        "SOR#095:6",
        "LOF#164:3",
        "SOR#095:4",
        "SOR#095:3",
        "SOR#095",
        "SOR#095:2"
      ],
      "baseUpgrades": [],
      "credits": 0,
      "hasForce": false,
      "discard": [],
      "cards": [
        {
          "id": "IC27#097:3",
          "zone": "ground",
          "damage": 0,
          "exhausted": false,
          "upgrades": [],
          "shields": 0,
          "experience": 0,
          "statusTokens": {},
          "captured": [],
          "power": 3,
          "hp": 1,
          "keywords": []
        },
        {
          "id": "LOF#164:4",
          "zone": "ground",
          "damage": 0,
          "exhausted": false,
          "upgrades": [],
          "shields": 0,
          "experience": 0,
          "statusTokens": {},
          "captured": [],
          "power": 4,
          "hp": 5,
          "keywords": [
            "overwhelm"
          ]
        },
        {
          "id": "IC27#097:4",
          "zone": "ground",
          "damage": 0,
          "exhausted": false,
          "upgrades": [],
          "shields": 0,
          "experience": 0,
          "statusTokens": {},
          "captured": [],
          "power": 3,
          "hp": 1,
          "keywords": []
        },
        {
          "id": "IC27#097:2",
          "zone": "ground",
          "damage": 0,
          "exhausted": false,
          "upgrades": [],
          "shields": 0,
          "experience": 0,
          "statusTokens": {},
          "captured": [],
          "power": 3,
          "hp": 1,
          "keywords": []
        }
      ],
      "deckSize": 6,
      "leader": {
        "id": "SOR#010",
        "deployed": false,
        "exhausted": false,
        "epicActionUsed": false
      }
    },
    "2": {
      "seat": 2,
      "baseHp": 17,
      "baseMaxHp": 30,
      "handSize": 4,
      "hand": [
        "SOR#232:4",
        "LOF#164:6",
        "IC27#097:7",
        "SOR#095:10"
      ],
      "resourcesReady": 6,
      "resourcesExhausted": 0,
      "resources": [
        "IC27#097:5",
        "LAW#253:5",
        "SOR#095:7",
        "SOR#232:3",
        "IC27#097:6",
        "LOF#164:5"
      ],
      "baseUpgrades": [],
      "credits": 0,
      "hasForce": false,
      "discard": [],
      "cards": [
        {
          "id": "SOR#095:8",
          "zone": "ground",
          "damage": 0,
          "exhausted": false,
          "upgrades": [],
          "shields": 0,
          "experience": 0,
          "statusTokens": {},
          "captured": [],
          "power": 3,
          "hp": 3,
          "keywords": []
        },
        {
          "id": "SOR#095:9",
          "zone": "ground",
          "damage": 0,
          "exhausted": false,
          "upgrades": [],
          "shields": 0,
          "experience": 0,
          "statusTokens": {},
          "captured": [],
          "power": 3,
          "hp": 3,
          "keywords": []
        },
        {
          "id": "LAW#253:6",
          "zone": "space",
          "damage": 0,
          "exhausted": false,
          "upgrades": [],
          "shields": 0,
          "experience": 0,
          "statusTokens": {},
          "captured": [],
          "power": 2,
          "hp": 3,
          "keywords": []
        },
        {
          "id": "LAW#253:7",
          "zone": "space",
          "damage": 0,
          "exhausted": false,
          "upgrades": [],
          "shields": 0,
          "experience": 0,
          "statusTokens": {},
          "captured": [],
          "power": 2,
          "hp": 3,
          "keywords": []
        }
      ],
      "deckSize": 6,
      "leader": {
        "id": "SOR#005",
        "deployed": false,
        "exhausted": false,
        "epicActionUsed": false
      }
    }
  },
  "initiativeTaken": false,
  "active": 1
}
