{
  "round": 2,
  "phase": "action",
  "initiative": 1,
  "initiativeTaken": false,
  "players": {
    "1": {
      "seat": 1,
      "baseHp": 30,
      "baseMaxHp": 30,
      "handSize": 1,
      "hand": [
        "SOR#108:5"
      ],
      "resourcesReady": 3,
      "resourcesExhausted": 0,
      "foreignResources": [],
      "credits": 0,
      "hasForce": false,
      "discard": [],
      "cards": [
        {
          "id": "SOR#108",
          "zone": "ground",
          "damage": 0,
          "exhausted": true,
          "upgrades": [],
          "shields": 0,
          "experience": 0,
          "statusTokens": {},
          "captured": [],
          "power": 4,
          "hp": 5,
          "keywords": [
            "overwhelm"
          ],
          "traits": [
            "creature"
          ]
        }
      ],
      "deckSize": 0,
      "leader": {
        "id": "SOR#010",
        "deployed": false,
        "exhausted": false,
        "epicActionUsed": false
      },
      "abilityUses": []
    },
    "2": {
      "seat": 2,
      "baseHp": 26,
      "baseMaxHp": 30,
      "handSize": 2,
      "hand": [
        "SOR#045",
        "SOR#045:5"
      ],
      "resourcesReady": 3,
      "resourcesExhausted": 0,
      "foreignResources": [],
      "credits": 0,
      "hasForce": false,
      "discard": [],
      "cards": [],
      "deckSize": 0,
      "leader": {
        "id": "SOR#005",
        "deployed": false,
        "exhausted": false,
        "epicActionUsed": false
      },
      "abilityUses": []
    }
  },
  "effects": []
}
