{
  "round": 4,
  "phase": "action",
  "initiative": 1,
  "players": {
    "1": {
      "seat": 1,
      "baseHp": 26,
      "baseMaxHp": 30,
      "handSize": 5,
      "hand": [
        "LAW#253:6",
        "JTL#221:3",
        "JTL#221:4",
        "LAW#253:7",
        "LAW#253:8"
      ],
      "resourcesReady": 5,
      "resourcesExhausted": 0,
      "resources": [
        "LAW#253",
        "LAW#253:2",
        "LAW#253:3",
        "LAW#253:4",
        "LAW#253:5"
      ],
      "foreignResources": [],
      "baseUpgrades": [],
      "baseCaptured": [],
      "credits": 0,
      "hasForce": false,
      "discard": [],
      "cards": [],
      "deckSize": 2,
      "leader": {
        "id": "SHD#013",
        "deployed": false,
        "exhausted": false,
        "epicActionUsed": false
      },
      "abilityUses": []
    },
    "2": {
      "seat": 2,
      "baseHp": 25,
      "baseMaxHp": 25,
      "handSize": 5,
      "hand": [
        "SOR#041:3",
        "IC27#097:6",
        "SOR#041:4",
        "IC27#097:7",
        "IC27#097:8"
      ],
      "resourcesReady": 5,
      "resourcesExhausted": 0,
      "resources": [
        "IC27#097",
        "IC27#097:2",
        "IC27#097:3",
        "IC27#097:4",
        "IC27#097:5"
      ],
      "foreignResources": [],
      "baseEpicActionUsed": false,
      "baseUpgrades": [],
      "baseCaptured": [],
      "credits": 0,
      "hasForce": false,
      "discard": [
        "SOR#041",
        "SOR#041:2"
      ],
      "cards": [
        {
          "id": "JTL#221",
          "zone": "space",
          "damage": 0,
          "exhausted": false,
          "upgrades": [],
          "shields": 0,
          "experience": 0,
          "statusTokens": {},
          "captured": [],
          "power": 4,
          "hp": 5,
          "keywords": [],
          "traits": [
            "transport",
            "underworld",
            "vehicle"
          ],
          "owner": 1
        },
        {
          "id": "JTL#221:2",
          "zone": "space",
          "damage": 0,
          "exhausted": false,
          "upgrades": [],
          "shields": 0,
          "experience": 0,
          "statusTokens": {},
          "captured": [],
          "power": 4,
          "hp": 5,
          "keywords": [],
          "traits": [
            "transport",
            "underworld",
            "vehicle"
          ],
          "owner": 1
        }
      ],
      "deckSize": 0,
      "leader": {
        "id": "SOR#010",
        "deployed": false,
        "exhausted": false,
        "epicActionUsed": false
      },
      "abilityUses": []
    }
  },
  "initiativeTaken": false,
  "active": 1,
  "effects": []
}
